{
  "media_type": "text/markdown",
  "name": "memory_design.md",
  "byte_length": 28412,
  "digest": "sha256:fedcba9876543210",
  "placement": {
    "kind": "indexed",
    "provider": "deepseek-harness/fs",
    "locator": "workspace://patchouli/memory_design.md",
    "revision": "fs-version-7"
  },
  "metadata": {
    "core": {
      "schema": "patchouli.artifact@1",
      "scope": {
        "tenant": null,
        "workspace": "patchouli",
        "user": "user-42",
        "session": null
      },
      "origin": {
        "provider": "deepseek-harness",
        "binding": "workspace-indexer",
        "native_type": "file",
        "native_id": "memory_design.md",
        "native_revision": "fs-version-7"
      },
      "time": {
        "event_at": null,
        "source_created_at": null,
        "source_updated_at": "2026-08-14T08:00:00Z",
        "observed_at": "2026-08-14T08:00:01Z",
        "ingested_at": "2026-08-14T08:00:02Z"
      },
      "lifecycle": {
        "status": "active",
        "expires_at": null
      },
      "provenance": [
        {
          "kind": "observed",
          "actor": "plugin:patchouli",
          "source": "workspace://patchouli/memory_design.md",
          "recorded_at": "2026-08-14T08:00:01Z"
        }
      ]
    },
    "extensions": {}
  }
}
