{
  "media_type": "application/pdf",
  "name": "memory-design.pdf",
  "byte_length": 483721,
  "digest": "sha256:0123456789abcdef",
  "placement": {
    "kind": "managed",
    "provider": "local",
    "key": "sha256/01/23456789abcdef"
  },
  "metadata": {
    "core": {
      "schema": "patchouli.artifact@1",
      "scope": {
        "tenant": null,
        "workspace": "patchouli",
        "user": "user-42",
        "session": null
      },
      "origin": {
        "provider": "deepseek-harness",
        "binding": "workspace-indexer",
        "native_type": "file",
        "native_id": "docs/memory-design.pdf",
        "native_revision": "fs-version-4"
      },
      "time": {
        "event_at": null,
        "source_created_at": null,
        "source_updated_at": "2026-08-14T08:00:00Z",
        "observed_at": "2026-08-14T08:00:01Z",
        "ingested_at": "2026-08-14T08:00:02Z"
      },
      "lifecycle": {
        "status": "active",
        "expires_at": null
      },
      "provenance": [
        {
          "kind": "imported",
          "actor": "plugin:patchouli",
          "source": "dsh-fs:docs/memory-design.pdf",
          "recorded_at": "2026-08-14T08:00:02Z"
        }
      ]
    },
    "extensions": {}
  }
}
